{
  "schema_version": "villani.task.v1",
  "task_id": "task_protocol_fixture",
  "run_id": "run_protocol_fixture",
  "created_at": "2026-07-10T00:00:00Z",
  "repository_path": "/fixture/repository",
  "instruction": "Correct the calculator add function and preserve the existing API.",
  "success_criteria": "The add function returns the sum and the repository test passes.",
  "constraints": ["Do not change the public function signature."],
  "requires_file_changes": true,
  "metadata": {
    "fixture": true
  }
}
